{
  "version": "0.2",
  "request_id": "req-2026-04-11-0001",
  "witness": {
    "witness_type": "authority",
    "version": "0.2",
    "iss": "bridge-issuer.core",
    "sub": "spiffe://acme/agents/reporting-worker",
    "act_for": "user:alice@example.com",
    "domain": "acme.prod.analytics",
    "purpose": "weekly revenue summary",
    "tool": "db.query.readonly",
    "resource": "postgres://analytics/reporting",
    "conf_label": {
      "level": "restricted",
      "compartments": [
        "finance"
      ],
      "tags": [
        "reporting"
      ],
      "marking": "internal-need-to-know"
    },
    "integ_label": {
      "level": "attested",
      "tags": [
        "signed",
        "measured-boot"
      ]
    },
    "audience": "tusk-broker://us-east-1/bridge",
    "nbf": "2026-04-11T14:00:00Z",
    "exp": "2026-04-11T14:02:00Z",
    "ttl_s": 120,
    "jti": "464e6650-b1b0-41f9-89da-47b9b43e8c2b",
    "trace": "ca14e9e0-1c8c-40bd-bc53-5d01e4876de8",
    "pop_key": {
      "binding": "spki-sha256",
      "proof_method": "signed-nonce",
      "kid": "run-2026-04-11-001",
      "value": "sha256-2d3e4f5a6b7c8d9e00112233445566778899aabbccddeeff0011223344556677",
      "nonce": "n-9Q4zprA7XCeM2sL"
    },
    "posture_digest": {
      "alg": "sha-256",
      "value": "99887766554433221100ffeeddccbbaa99887766554433221100ffeeddccbbaa",
      "issued_at": "2026-04-11T13:59:40Z"
    },
    "model_digest": {
      "alg": "sha-256",
      "value": "8be4a6073ef1f3e3e9b9ce2e5a4cf8a2761ed01b2adca99ec53b8f0bd8d9f111"
    },
    "connector_digest": {
      "alg": "sha-256",
      "value": "beadbeadbeadbeadbeadbeadbeadbeadbeadbeadbeadbeadbeadbeadbeadbead"
    },
    "constraints": {
      "verb_class": "read",
      "single_use": true,
      "rows_max": 5000,
      "max_bytes": 1048576,
      "rate_per_min": 10,
      "human_review_required": false,
      "max_secret_materializations": 1
    },
    "egress_policy": {
      "mode": "allowlist",
      "destinations": [
        "postgres://analytics/reporting"
      ]
    },
    "output_policy": {
      "redaction_profile": "finance-summary-v1",
      "max_response_bytes": 65536,
      "allow_secrets_in_output": false,
      "return_to_model": true,
      "strip_html": true,
      "classify_output": true
    },
    "approval_mode": "none",
    "issuer_alg": "EdDSA",
    "sig": {
      "alg": "EdDSA",
      "key_id": "bridge-issuer-2026-q2",
      "key_epoch": "2026Q2",
      "value": "dGVzdC1zaWduYXR1cmUtYmFzZTY0dXJsLXN0dWI"
    }
  },
  "call": {
    "requested_tool": "db.query.readonly",
    "requested_resource": "postgres://analytics/reporting",
    "source_domain": "acme.prod.analytics",
    "destination_domain": "acme.prod.analytics",
    "cross_domain": false,
    "payload_hash": "",
    "session_nonce": "n-9Q4zprA7XCeM2sL",
    "rp_initiated": true,
    "pop_proof": {
      "kind": "signed-nonce",
      "verified": true,
      "nonce": "n-9Q4zprA7XCeM2sL",
      "proof_value": "base64url-proof-placeholder"
    },
    "transport": {
      "protocol": "https",
      "mtls_client_id": "spiffe://acme/agents/reporting-worker",
      "remote_addr": "10.10.4.22"
    },
    "client_context": {
      "trace_parent": "00-ca14e9e01c8c40bdbc535d01e4876de8-0123456789abcdef-01",
      "ui_surface": "agent-session",
      "user_intent_summary": "weekly revenue summary"
    }
  }
}